{
 "schema": "kicad-route/blocked/2",
 "version": 2,
 "source": "run",
 "heuristic": true,
 "method": "straight and L-shaped corridors (net-class track width + 2 x clearance) between the two endpoints of each unconnected item, per copper layer; heuristic pointer, not a proof",
 "boards": {
  "input_sha256": "00e7f80c33f5dbe4f7464204f882c338c752cdc19e4eb6ce1dd2c6987137b544",
  "candidate_sha256": "6d9bff3b8549adced113e0e7987dab5903d2cd8badb0c294e72c6b773600ae5e",
  "graded_sha256": "6d9bff3b8549adced113e0e7987dab5903d2cd8badb0c294e72c6b773600ae5e"
 },
 "nets_considered": [
  "/SIG_A_OUT",
  "/SIG_B_OUT",
  "/VIN",
  "GND"
 ],
 "copper_layers": [
  "F.Cu",
  "B.Cu"
 ],
 "connections_analyzed": 4,
 "unobstructed_connections": 0,
 "category_notes": {
  "keepout": "rule area: part of the design's constraints; route around it, never edit it",
  "input_copper": "copper from the attempt's input: moving it needs the owner's permission (--protect locked frees only unlocked input copper)",
  "new_copper": "the backend's own output in this attempt: cheap to rip (re-route in another order or scope)",
  "footprint": "pads of other nets: placement is fixed for routing; go around or change layer",
  "board_edge": "the corridor leaves the board outline"
 },
 "ranking": {
  "keepout": [
   {
    "id": "rule_area:wall",
    "kind": "rule_area",
    "name": "wall",
    "net": null,
    "restrictions": [
     "tracks",
     "vias",
     "zone_fills"
    ],
    "rule_area_layers": [
     "B.Cu",
     "F.Cu"
    ],
    "bbox_mm": [
     138.0,
     99.0,
     140.0,
     131.0
    ],
    "category": "keepout",
    "blocks": 4,
    "blocks_any_layer": 4,
    "layers": [
     "B.Cu",
     "F.Cu"
    ],
    "nets_blocked": [
     "/SIG_A_OUT",
     "/SIG_B_OUT",
     "/VIN",
     "GND"
    ],
    "label": "keepout 'wall' (no tracks, no vias, no zone fills) on B.Cu, F.Cu"
   },
   {
    "id": "rule_area:route_keepout",
    "kind": "rule_area",
    "name": "route_keepout",
    "net": null,
    "restrictions": [
     "tracks",
     "vias",
     "zone_fills"
    ],
    "rule_area_layers": [
     "B.Cu",
     "F.Cu"
    ],
    "bbox_mm": [
     119.0,
     105.0,
     131.0,
     122.0
    ],
    "category": "keepout",
    "blocks": 3,
    "blocks_any_layer": 3,
    "layers": [
     "B.Cu",
     "F.Cu"
    ],
    "nets_blocked": [
     "/SIG_A_OUT",
     "/VIN",
     "GND"
    ],
    "label": "keepout 'route_keepout' (no tracks, no vias, no zone fills) on B.Cu, F.Cu"
   }
  ],
  "input_copper": [],
  "new_copper": [
   {
    "id": "c56df3e3-cc04-43a6-b33d-7fd084ecea23",
    "kind": "track",
    "net": "/SIG_A",
    "layer": "F.Cu",
    "locked": false,
    "origin": "new",
    "uuid": "c56df3e3-cc04-43a6-b33d-7fd084ecea23",
    "width_mm": 0.2,
    "start_mm": [
     105.6,
     111.1
    ],
    "end_mm": [
     113.7,
     103.0
    ],
    "category": "new_copper",
    "blocks": 0,
    "blocks_any_layer": 2,
    "layers": [],
    "nets_blocked": [
     "/VIN",
     "GND"
    ],
    "label": "track /SIG_A F.Cu (new, unlocked) c56df3e3"
   }
  ],
  "footprint": [],
  "board_edge": [],
  "input_copper_by_net": [],
  "new_copper_by_net": [
   {
    "net": "/SIG_A",
    "items": 1,
    "locked": 0,
    "blocks": 0
   }
  ],
  "truncated": {}
 },
 "top": [
  {
   "id": "rule_area:wall",
   "category": "keepout",
   "kind": "rule_area",
   "label": "keepout 'wall' (no tracks, no vias, no zone fills) on B.Cu, F.Cu",
   "net": null,
   "blocks": 4,
   "blocks_any_layer": 4,
   "nets_blocked": [
    "/SIG_A_OUT",
    "/SIG_B_OUT",
    "/VIN",
    "GND"
   ]
  },
  {
   "id": "rule_area:route_keepout",
   "category": "keepout",
   "kind": "rule_area",
   "label": "keepout 'route_keepout' (no tracks, no vias, no zone fills) on B.Cu, F.Cu",
   "net": null,
   "blocks": 3,
   "blocks_any_layer": 3,
   "nets_blocked": [
    "/SIG_A_OUT",
    "/VIN",
    "GND"
   ]
  },
  {
   "id": "c56df3e3-cc04-43a6-b33d-7fd084ecea23",
   "category": "new_copper",
   "kind": "track",
   "label": "track /SIG_A F.Cu (new, unlocked) c56df3e3",
   "net": "/SIG_A",
   "locked": false,
   "origin": "new",
   "blocks": 0,
   "blocks_any_layer": 2,
   "nets_blocked": [
    "/VIN",
    "GND"
   ]
  }
 ],
 "nets": {
  "/SIG_A_OUT": {
   "connections": 1,
   "best_layer": "F.Cu",
   "hard_blockers_on_best_layer": 2,
   "blockers": [
    "keepout 'route_keepout'",
    "keepout 'wall'"
   ]
  },
  "/SIG_B_OUT": {
   "connections": 1,
   "best_layer": "F.Cu",
   "hard_blockers_on_best_layer": 1,
   "blockers": [
    "keepout 'wall'"
   ]
  },
  "/VIN": {
   "connections": 1,
   "best_layer": "B.Cu",
   "hard_blockers_on_best_layer": 2,
   "blockers": [
    "keepout 'route_keepout'",
    "keepout 'wall'"
   ]
  },
  "GND": {
   "connections": 1,
   "best_layer": "B.Cu",
   "hard_blockers_on_best_layer": 2,
   "blockers": [
    "keepout 'route_keepout'",
    "keepout 'wall'"
   ]
  }
 },
 "footprints": {
  "J2": {
   "reference": "J2",
   "value": "Conn_01x04",
   "position_mm": [
    146.0,
    106.0
   ],
   "orientation_deg": 0.0,
   "layer": "F.Cu",
   "side": "front",
   "locked": false,
   "blocks": [],
   "blocks_any_layer": [],
   "terminates": [
    0,
    1,
    2,
    3
   ],
   "pads_blocking": [],
   "nets_blocked": [],
   "nets_terminated": [
    "/SIG_A_OUT",
    "/SIG_B_OUT",
    "/VIN",
    "GND"
   ]
  },
  "R1": {
   "reference": "R1",
   "value": "33",
   "position_mm": [
    125.0,
    103.0
   ],
   "orientation_deg": 0.0,
   "layer": "F.Cu",
   "side": "front",
   "locked": false,
   "blocks": [],
   "blocks_any_layer": [],
   "terminates": [
    2
   ],
   "pads_blocking": [],
   "nets_blocked": [],
   "nets_terminated": [
    "/SIG_A_OUT"
   ]
  },
  "R2": {
   "reference": "R2",
   "value": "33",
   "position_mm": [
    125.0,
    126.0
   ],
   "orientation_deg": 0.0,
   "layer": "F.Cu",
   "side": "front",
   "locked": false,
   "blocks": [],
   "blocks_any_layer": [],
   "terminates": [
    3
   ],
   "pads_blocking": [],
   "nets_blocked": [],
   "nets_terminated": [
    "/SIG_B_OUT"
   ]
  }
 },
 "connections": [
  {
   "index": 0,
   "net": "/VIN",
   "netclass": "Power",
   "corridor_width_mm": 1.1,
   "endpoints": [
    {
     "description": "PTH pad 1 [/VIN] of J2",
     "uuid": "993f7ea8-1128-4542-b649-178db9de8ce7",
     "kind": "pad",
     "net": "/VIN",
     "footprint": "J2",
     "pad": "1",
     "layers": [
      "B.Cu",
      "F.Cu"
     ],
     "position_mm": [
      146.0,
      106.0
     ],
     "reported_position_mm": [
      146.0,
      106.0
     ]
    },
    {
     "description": "Track [/VIN] on F.Cu, length 3.0500 mm",
     "uuid": "2405dd5d-c7d7-46c7-aedd-774f35aad6a5",
     "kind": "track",
     "net": "/VIN",
     "footprint": null,
     "pad": null,
     "layers": [
      "F.Cu"
     ],
     "position_mm": [
      106.0,
      104.0
     ],
     "reported_position_mm": [
      106.0,
      104.0
     ]
    }
   ],
   "layers": {
    "F.Cu": {
     "corridor": "L_horizontal_first",
     "hard_count": 3,
     "soft_count": 0,
     "hard": [
      {
       "id": "c56df3e3-cc04-43a6-b33d-7fd084ecea23",
       "kind": "track",
       "category": "new_copper",
       "net": "/SIG_A",
       "layer": "F.Cu",
       "locked": false,
       "origin": "new",
       "label": "track /SIG_A F.Cu c56df3e3"
      },
      {
       "id": "rule_area:route_keepout",
       "kind": "rule_area",
       "category": "keepout",
       "name": "route_keepout",
       "net": null,
       "restrictions": [
        "tracks",
        "vias",
        "zone_fills"
       ],
       "label": "keepout 'route_keepout'"
      },
      {
       "id": "rule_area:wall",
       "kind": "rule_area",
       "category": "keepout",
       "name": "wall",
       "net": null,
       "restrictions": [
        "tracks",
        "vias",
        "zone_fills"
       ],
       "label": "keepout 'wall'"
      }
     ],
     "soft": [],
     "corridors": {
      "straight": {
       "hard": 6,
       "soft": 0
      },
      "L_horizontal_first": {
       "hard": 3,
       "soft": 0
      },
      "L_vertical_first": {
       "hard": 7,
       "soft": 0
      }
     }
    },
    "B.Cu": {
     "corridor": "L_horizontal_first",
     "hard_count": 2,
     "soft_count": 1,
     "hard": [
      {
       "id": "rule_area:route_keepout",
       "kind": "rule_area",
       "category": "keepout",
       "name": "route_keepout",
       "net": null,
       "restrictions": [
        "tracks",
        "vias",
        "zone_fills"
       ],
       "label": "keepout 'route_keepout'"
      },
      {
       "id": "rule_area:wall",
       "kind": "rule_area",
       "category": "keepout",
       "name": "wall",
       "net": null,
       "restrictions": [
        "tracks",
        "vias",
        "zone_fills"
       ],
       "label": "keepout 'wall'"
      }
     ],
     "soft": [
      {
       "id": "zone:GND_B:GND",
       "kind": "zone",
       "category": "zone",
       "name": "GND_B",
       "net": "GND",
       "label": "zone 'GND_B' GND"
      }
     ],
     "corridors": {
      "straight": {
       "hard": 4,
       "soft": 1
      },
      "L_horizontal_first": {
       "hard": 2,
       "soft": 1
      },
      "L_vertical_first": {
       "hard": 3,
       "soft": 1
      }
     }
    }
   },
   "length_mm": 40.05,
   "best_layer": "B.Cu",
   "best_layer_hard_count": 2
  },
  {
   "index": 1,
   "net": "GND",
   "netclass": "Power",
   "corridor_width_mm": 1.1,
   "endpoints": [
    {
     "description": "PTH pad 2 [GND] of J2",
     "uuid": "064cb8bd-5418-483b-8a32-078800da63ae",
     "kind": "pad",
     "net": "GND",
     "footprint": "J2",
     "pad": "2",
     "layers": [
      "B.Cu",
      "F.Cu"
     ],
     "position_mm": [
      146.0,
      108.54
     ],
     "reported_position_mm": [
      146.0,
      108.54
     ]
    },
    {
     "description": "Zone 'GND_B' [GND] on B.Cu, priority 0",
     "uuid": "0f51a515-5ebb-426a-91a1-1034db8ae453",
     "kind": "zone",